{
  "schemaVersion": 7,
  "id": "chapter-01-daze",
  "title": {
    "en": "SHI — The Shape of Power",
    "ar": "شِي — هيئة القوّة",
    "de": "SHI — Die Gestalt der Macht",
    "es": "SHI — La forma del poder",
    "fr": "SHI — La forme du pouvoir",
    "ja": "勢 — 力のかたち",
    "ko": "세 — 힘의 형세",
    "ru": "ШИ — Форма власти",
    "vi": "THẾ — Hình của quyền lực",
    "zh-Hans": "势 — 权力之形",
    "zh-Hant": "勢 — 權力之形"
  },
  "subtitle": {
    "en": "Chapter I · Rain at Daze Village",
    "ar": "الفصل الأول · مطر قرية دازِه",
    "de": "Kapitel I · Regen in Daze",
    "es": "Capítulo I · Lluvia en Daze",
    "fr": "Chapitre I · Pluie sur Daze",
    "ja": "第一章 · 大沢郷の雨",
    "ko": "제1장 · 대택향의 비",
    "ru": "Глава I · Дождь в Дацзэ",
    "vi": "Chương I · Mưa ở Đại Trạch",
    "zh-Hans": "第一章 · 大泽乡雨",
    "zh-Hant": "第一章 · 大澤鄉雨"
  },
  "startNodeId": "rain-order",
  "acts": [
    {
      "id": "register",
      "title": {
        "en": "The register",
        "ar": "السجل",
        "de": "Das Register",
        "es": "El registro",
        "fr": "Le registre",
        "ja": "名簿",
        "ko": "명부",
        "ru": "Реестр",
        "vi": "Sổ danh",
        "zh-Hans": "名籍",
        "zh-Hant": "名籍"
      },
      "objective": {
        "en": "Turn nine hundred isolated names into one political body without hiding the obligation created.",
        "ar": "حوّل تسعمئة اسم منفصل إلى جسد سياسي واحد من دون إخفاء الالتزام الناشئ.",
        "de": "Forme aus neunhundert vereinzelten Namen einen politischen Körper, ohne die entstehende Verpflichtung zu verschweigen.",
        "es": "Convierte novecientos nombres aislados en un cuerpo político sin ocultar la obligación que nace.",
        "fr": "Faire de neuf cents noms isolés un corps politique sans cacher l’obligation ainsi créée.",
        "ja": "九百の孤立した名を、生まれる責務を隠さず一つの政治的共同体へ変える。",
        "ko": "고립된 구백 개의 이름을, 생겨난 의무를 감추지 않고 하나의 정치 공동체로 바꾼다.",
        "ru": "Превратить девятьсот разрозненных имён в единое политическое целое, не скрывая возникшего обязательства.",
        "vi": "Biến chín trăm cái tên rời rạc thành một cộng đồng chính trị mà không che giấu nghĩa vụ vừa hình thành.",
        "zh-Hans": "让九百个孤立的名字成为一个政治共同体，同时不掩盖由此产生的义务。",
        "zh-Hant": "讓九百個孤立的名字成為一個政治共同體，同時不掩蓋由此產生的義務。"
      }
    },
    {
      "id": "organization",
      "title": {
        "en": "The cost of organization",
        "ar": "كلفة التنظيم",
        "de": "Der Preis der Organisation",
        "es": "El coste de organizarse",
        "fr": "Le coût de l’organisation",
        "ja": "組織の代価",
        "ko": "조직의 대가",
        "ru": "Цена организации",
        "vi": "Cái giá của tổ chức",
        "zh-Hans": "组织的代价",
        "zh-Hant": "組織的代價"
      },
      "objective": {
        "en": "Turn declared purpose into rules for grain, signals, and accountable witnesses.",
        "ar": "حوّل الغاية المعلنة إلى قواعد للمؤن والإشارات والشهود المسؤولين.",
        "de": "Übersetze den erklärten Zweck in Regeln für Getreide, Signale und verantwortliche Zeugen.",
        "es": "Convierte el propósito declarado en reglas para el grano, las señales y los testigos responsables.",
        "fr": "Transformer le but déclaré en règles pour le grain, les signaux et les témoins responsables.",
        "ja": "掲げた目的を、糧食・合図・責任ある証人の規則へ変える。",
        "ko": "선언한 목적을 식량, 신호, 책임지는 증인의 규칙으로 바꾼다.",
        "ru": "Превратить провозглашённую цель в правила для зерна, сигналов и ответственных свидетелей.",
        "vi": "Biến mục đích đã tuyên bố thành quy tắc cho lương thực, tín hiệu và những người làm chứng có trách nhiệm.",
        "zh-Hans": "把公开宣示的目的变成粮食、信号与责任见证的规则。",
        "zh-Hant": "把公開宣示的目的變成糧食、信號與責任見證的規則。"
      }
    },
    {
      "id": "crossing",
      "title": {
        "en": "The crossing",
        "ar": "المعبر",
        "de": "Der Übergang",
        "es": "El cruce",
        "fr": "La traversée",
        "ja": "渡河",
        "ko": "도하",
        "ru": "Переправа",
        "vi": "Cuộc vượt sông",
        "zh-Hans": "渡口",
        "zh-Hant": "渡口"
      },
      "objective": {
        "en": "Pay the promise’s cost, survive pursuit, and choose the network’s next shape.",
        "ar": "ادفع كلفة الوعد، وانجُ من المطاردة، واختر الهيئة التالية للشبكة.",
        "de": "Trage die Kosten des Versprechens, überstehe die Verfolgung und wähle die nächste Gestalt des Netzwerks.",
        "es": "Paga el coste de la promesa, sobrevive a la persecución y elige la próxima forma de la red.",
        "fr": "Payer le prix de la promesse, survivre à la poursuite et choisir la prochaine forme du réseau.",
        "ja": "約束の代価を払い、追跡を生き延び、次のネットワークの形を選ぶ。",
        "ko": "약속의 대가를 치르고 추격에서 살아남아 네트워크의 다음 형태를 선택한다.",
        "ru": "Заплатить цену обещания, пережить преследование и выбрать следующую форму сети.",
        "vi": "Trả giá cho lời hứa, sống sót qua cuộc truy đuổi và chọn hình thế tiếp theo của mạng lưới.",
        "zh-Hans": "支付承诺的代价，在追击中存续，并选择网络的下一种形态。",
        "zh-Hant": "支付承諾的代價，在追擊中存續，並選擇網絡的下一種形態。"
      }
    }
  ],
  "initialResources": {
    "grain": 42,
    "trust": 38,
    "momentum": 22,
    "people": 58,
    "danger": 46
  },
  "commitments": [
    {
      "id": "names-under-protection",
      "claimStatus": "dramatic-reconstruction",
      "establishedByChoiceId": "read-the-names",
      "stakeholderId": "yu-mu",
      "title": {
        "en": "Names under protection",
        "zh-Hans": "名在护约之下",
        "zh-Hant": "名在護約之下"
      },
      "promise": {
        "en": "Every name read into the covenant will cross as a person, not be discarded as anonymous freight.",
        "zh-Hans": "每个被读入盟约的名字，都要作为人过河，而不是作为无名负担被丢下。",
        "zh-Hant": "每個被讀入盟約的名字，都要作為人過河，而不是作為無名負擔被丟下。"
      },
      "outcomes": [
        {
          "id": "names-families-kept",
          "choiceId": "families-first",
          "status": "kept",
          "forecast": {
            "en": "Households cross before carts. The covenant's named protection is kept.",
            "zh-Hans": "家户先于车辆过河。盟约对有名之人的保护得到兑现。",
            "zh-Hant": "家戶先於車輛過河。盟約對有名之人的保護得到兌現。"
          },
          "response": {
            "en": "Aunt Yu counts the last household onto the far bank before she nods to the rear guard.",
            "zh-Hans": "妪母数着最后一户登上对岸，才向后卫点头。",
            "zh-Hant": "嫗母數著最後一戶登上對岸，才向後衛點頭。"
          },
          "effects": { "trust": 4 }
        },
        {
          "id": "names-ford-strained",
          "choiceId": "repair-the-ford",
          "status": "strained",
          "forecast": {
            "en": "Bracing the ford protects the column, but named households wait in the pursuing rain.",
            "zh-Hans": "加固渡口能保全队伍，有名在册的家户却要在追兵迫近的雨里等待。",
            "zh-Hant": "加固渡口能保全隊伍，有名在冊的家戶卻要在追兵迫近的雨裡等待。"
          },
          "response": {
            "en": "The braces hold. Aunt Yu accepts the passage, not the delay imposed on those promised protection first.",
            "zh-Hans": "支架撑住了。妪母接受这条生路，却不接受让先受保护者久候。",
            "zh-Hant": "支架撐住了。嫗母接受這條生路，卻不接受讓先受保護者久候。"
          },
          "effects": { "momentum": 1, "trust": -2 }
        },
        {
          "id": "names-carts-broken",
          "choiceId": "cut-the-carts",
          "status": "broken",
          "forecast": {
            "en": "Abandoning the loads leaves named households to recover what the movement will not carry.",
            "zh-Hans": "弃下车辆，会让有名在册的家户折返去取队伍不再承担的物资。",
            "zh-Hant": "棄下車輛，會讓有名在冊的家戶折返去取隊伍不再承擔的物資。"
          },
          "response": {
            "en": "Aunt Yu sees families turn back toward the carts. Their names remain in the covenant; its protection does not.",
            "zh-Hans": "妪母看着家户转身寻找车辆。名字仍在盟约里，保护却已不在。",
            "zh-Hant": "嫗母看著家戶轉身尋找車輛。名字仍在盟約裡，保護卻已不在。"
          },
          "effects": { "trust": -4, "danger": 2 }
        }
      ]
    },
    {
      "id": "movement-before-answer",
      "claimStatus": "dramatic-reconstruction",
      "establishedByChoiceId": "take-the-beacon",
      "stakeholderId": "wu-guang",
      "title": {
        "en": "Movement before the posts answer",
        "zh-Hans": "先于亭驿回应而动",
        "zh-Hant": "先於亭驛回應而動"
      },
      "promise": {
        "en": "The seized beacon will become movement before the relay network can take back the initiative.",
        "zh-Hans": "夺下的烽燧必须化为行动，不能让亭驿传信网夺回先手。",
        "zh-Hant": "奪下的烽燧必須化為行動，不能讓亭驛傳信網奪回先手。"
      },
      "outcomes": [
        {
          "id": "movement-families-strained",
          "choiceId": "families-first",
          "status": "strained",
          "forecast": {
            "en": "Protecting households slows the seized tempo but makes the delay publicly defensible.",
            "zh-Hans": "保护家户会放慢抢来的节奏，却能让延误有公开可辩的理由。",
            "zh-Hant": "保護家戶會放慢搶來的節奏，卻能讓延誤有公開可辯的理由。"
          },
          "response": {
            "en": "Wu Guang watches the rear guard wait. The movement loses time, but not the reason people gave it time.",
            "zh-Hans": "吴广看着后卫停步。队伍失去了时间，却没有失去众人愿意给它时间的理由。",
            "zh-Hant": "吳廣看著後衛停步。隊伍失去了時間，卻沒有失去眾人願意給它時間的理由。"
          },
          "effects": { "trust": 1, "momentum": -2 }
        },
        {
          "id": "movement-ford-broken",
          "choiceId": "repair-the-ford",
          "status": "broken",
          "forecast": {
            "en": "Stationary labor at the ford returns initiative to the relay posts.",
            "zh-Hans": "在渡口停留劳作，会把先手还给亭驿。",
            "zh-Hant": "在渡口停留勞作，會把先手還給亭驛。"
          },
          "response": {
            "en": "The repair saves provisions, but the captured signal becomes yesterday's fact while patrol reports catch up.",
            "zh-Hans": "修渡保住了物资，夺烽却在巡报追上时变成了昨日的既成事实。",
            "zh-Hant": "修渡保住了物資，奪烽卻在巡報追上時變成了昨日的既成事實。"
          },
          "effects": { "momentum": -4, "danger": 2 }
        },
        {
          "id": "movement-carts-kept",
          "choiceId": "cut-the-carts",
          "status": "kept",
          "forecast": {
            "en": "Cutting the carts turns the stolen signal into immediate movement.",